{
  "schemaVersion": "1.0",
  "governanceVersion": "v1.5.0",
  "catalogueVersion": "1.2.0",
  "profileKey": "php-laravel",
  "sourceSha": "aaaaaaaaaaaaaaaaaaaaaaaaaaaaaaaaaaaaaaaa",
  "artifactId": "ART-LARAVEL-20260913-0001",
  "imageRepository": "ghcr.io/oxy7o/example-app-laravel",
  "dockerfilePath": "Dockerfile",
  "contextPath": ".",
  "platforms": ["linux/amd64"],
  "retentionDays": 30,
  "evidenceMode": "safe-metadata"
}
